{
  "case_id": "BenchmarkTest00207",
  "verdict": "INCONCLUSIVE",
  "reason_code": "PARTIAL_EVIDENCE_UNRESOLVED",
  "confidence": 0.5,
  "required_evidence_items_passed": {
    "static_path_evidence": true,
    "symbolic_feasibility": true,
    "successful_replay": true,
    "runtime_taint_evidence": false,
    "security_condition_satisfied": true,
    "negative_control": true,
    "provenance_and_hashes": true
  },
  "evidence_hash": "16cf37365258b450fb954d8f1d7a1be26bf1e665d3203bd9402aa6db9cc69927",
  "inconclusive_reason": "Missing affirmative proof for: runtime_taint_evidence",
  "recommended_next_action": "Inspect solver constraints and dynamic instrumentation",
  "timestamp": "2026-09-09T10:59:49.170Z"
}